{
  "schema_version": "telemetry-p4-window/v1",
  "source_profile": "p4-bounded-aggregate-dual-bank/v1",
  "source_profile_digest": "sha256:0a03cb7fd8b61307d2d60e008c911a77268f57da3adea3b553a4027c17290c9b",
  "telemetry_source_id": "p4-source-bmv2-test-1",
  "target_id": "bmv2-test-1",
  "shard_id": "bmv2-test-1",
  "capture_adapter_id": "p4runtime-bounded-aggregate",
  "endpoint_identity": "p4runtime-bmv2-test-1",
  "flow_identity_profile": {
    "schema_version": "telemetry-flow-identity-profile/v1",
    "shard_id": "bmv2-test-1",
    "capture_adapter_id": "p4runtime-bounded-aggregate",
    "endpoint_identity": "p4runtime-bmv2-test-1",
    "direction": "ingress",
    "supported_ip_versions": ["ipv4"],
    "endpoint_ordering": "unidirectional-observation-order",
    "vlan_id_included": false,
    "tunnel_id_included": false,
    "fragment_semantics": "fragment-class-preserved",
    "l4_unavailable_semantics": "port-unavailable-with-absent-ports",
    "selector_algorithm": "p4-qualified-cell-selector/v1",
    "selector_seed_digest": "sha256:0a03cb7fd8b61307d2d60e008c911a77268f57da3adea3b553a4027c17290c9b",
    "exposure": "aggregate-cell-selector-digest-only"
  },
  "device_id": 1,
  "role": "masi-edge",
  "observation_domain": "bmv2-test-domain",
  "observation_point": "p4-ingress-pre-firewall",
  "pipeline_identity": {
    "p4_program_digest": "sha256:4e38d5bc749f3742e38ce5362536ad9af2cab8f232d0644bdb53d1e2e17507ec",
    "p4info_digest": "sha256:23b6d3554ca11843b7e0324352ed09752f068a05abbecf16c16d08a9839d2241",
    "pipeline_digest": "sha256:06b99f73133ff8a7d0bfbcfe2b023ecdd5a9458f8e41afd5f11275e5d99d00ea"
  },
  "application_generation": 1,
  "source_runtime_epoch": "source-epoch-golden-1",
  "window": {
    "window_id": "window-golden-1",
    "window_start": "2030-01-01T00:00:00Z",
    "window_end": "2030-01-01T00:00:10Z",
    "event_time_basis": "target-aggregate-export-time",
    "watermark": "2030-01-01T00:00:10Z",
    "allowed_lateness_ms": 1000,
    "finalized_at": "2030-01-01T00:00:11Z",
    "produced_at": "2030-01-01T00:00:11.010Z"
  },
  "bank": 0,
  "epoch": 1,
  "source_sequence": {
    "expected_start": 1,
    "expected_end": 2,
    "observed_start": 1,
    "observed_end": 2,
    "gap_ranges": []
  },
  "snapshot": {
    "strategy": "dual-bank-sequence-before-after",
    "active_bank_after_flip": 1,
    "frozen_bank": 0,
    "sequence_before": 2,
    "sequence_after": 2,
    "expected_entries": 256,
    "observed_entries": 256,
    "consistency": "consistent"
  },
  "cell_count": 256,
  "reported_nonzero_cells": 1,
  "aggregate": {"packets": 2, "bytes": 108},
  "cells": [
    {
      "index": 17,
      "packets": 2,
      "bytes": 108,
      "selector_digest": "sha256:87baa9cb5c99bad5224c947c961a353e33f055c5102f4853bced66e189dec660"
    }
  ],
  "sampling": {
    "algorithm": "sequence-modulo",
    "period_packets": 1024,
    "eligible_population": 2,
    "expected_hints": 0,
    "observed_hints": 0,
    "coverage": 1.0,
    "selector": "source-sequence-modulo-period",
    "seed_digest": "sha256:0a03cb7fd8b61307d2d60e008c911a77268f57da3adea3b553a4027c17290c9b",
    "weighting": "none-hint-only",
    "estimation_error_ppm": 1000000,
    "complete_population_claim": false
  },
  "drops": {"p4": 0, "server": 0, "channel": 0, "client": 0, "packet_in": 0, "digest": 0},
  "time_semantics": {
    "event_time_min_unix_ms": 1893456000000,
    "event_time_max_unix_ms": 1893456010000,
    "packet_time_observed": false,
    "packet_time_semantics": "not-observed-by-p4-bounded-aggregate",
    "monotonic_queue_age_ms": 10,
    "monotonic_deadline_budget_ms": 2000
  },
  "clear_advance_condition": "frozen-bank-readback-then-explicit-clear",
  "quality": {"status": "valid", "reasons": ["NONE"]}
}
